HallOfFameID,EmployeeID,AchievementDate,AchievementType,Description
180,158,2022-11-29,Certification,Spring high speak heavy floor dog.
692,150,2023-01-10,Certification,Take you myself of agreement.
360,132,2023-01-31,Award,Political soon turn argue.
51,166,2022-08-21,Certification,Smile public bad recently form information.
210,127,2023-02-19,Community Contribution,Rule its day six eye who.
151,150,2024-06-01,Certification,Color Mrs Mrs seven list daughter Mr.
722,168,2024-06-23,Award,Color mission fire maybe phone hot number reality.
280,127,2023-05-26,Award,Wife officer myself finish between.
146,146,2022-09-24,Award,Fine sometimes toward avoid without to.
280,123,2022-12-23,Certification,News modern government number.
680,189,2023-05-09,Certification,Stock candidate year member entire.
648,108,2022-07-30,Community Contribution,Pay age try station plant.
556,156,2023-05-14,Certification,Fire thing still form.
783,179,2023-11-07,Community Contribution,Must bad nice family.
502,200,2024-05-11,Award,Purpose generation laugh.
123,165,2023-03-03,Award,Owner argue nation quickly.
533,169,2022-06-29,Certification,City politics determine hour simple.
893,157,2024-05-14,Award,Vote despite idea main may.
584,147,2024-04-19,Community Contribution,Charge into particular tax for including wish see.
781,147,2023-07-22,Certification,Stock anyone yes concern traditional.
799,148,2023-05-31,Award,Although four similar.
662,143,2022-12-21,Certification,Bed loss decision teacher social anyone.
467,186,2022-08-13,Community Contribution,Rise national matter nor contain charge fact.
553,127,2022-10-28,Community Contribution,Clear involve want push know.
5,153,2024-01-27,Community Contribution,Continue soon truth listen.
210,126,2024-01-30,Community Contribution,Close mouth style.
659,160,2024-02-19,Community Contribution,Half long book information.
970,148,2024-01-30,Award,Second your writer choice over throw.
692,149,2023-07-21,Award,Blood worker magazine position.
47,125,2023-06-01,Certification,Order responsibility institution.
111,105,2023-07-14,Certification,About area seek instead cold.
49,188,2023-05-05,Award,Begin ever inside final make.
694,149,2023-10-15,Community Contribution,Discussion check bank great international forward fly.
592,177,2023-01-03,Award,Yet well job game.
48,179,2023-05-18,Award,Avoid fine third nor.
794,128,2023-06-30,Community Contribution,Collection our specific local customer morning economic.
881,110,2023-03-08,Certification,Reveal let role second certainly meeting.
996,145,2024-05-16,Certification,Clear sense myself.
868,126,2023-03-13,Community Contribution,Situation top protect past grow.
386,137,2023-07-07,Award,Push wall upon though read finish.
349,187,2023-07-15,Certification,Challenge generation relate last worry dark baby network.
226,130,2023-07-08,Community Contribution,Employee sense approach open.
193,124,2024-02-21,Award,Computer professional against ever.
511,188,2023-05-20,Community Contribution,Something miss religious purpose.
629,114,2024-02-16,Award,Recently think direction attorney door.
752,125,2022-12-31,Award,Offer pattern station should already position experience you.
312,178,2023-01-07,Award,Black the test plan all.
779,175,2022-10-19,Award,First support behavior table skill expect former.
854,127,2023-12-16,Award,From partner couple serve interesting effort need name.
980,125,2022-09-03,Award,Significant method positive newspaper situation head must.
834,167,2023-11-22,Community Contribution,People role shake prepare group trial.
68,152,2023-07-02,Community Contribution,Above never example chance management staff improve.
475,113,2024-05-18,Community Contribution,Fact population movement everybody trouble trade month tell.
872,128,2023-04-10,Certification,Item although whole medical.
839,104,2024-05-19,Award,Six local production along.
301,161,2022-10-19,Award,Total high ground leg themselves church.
70,170,2024-05-11,Award,Science treat most nature.
301,137,2023-12-09,Community Contribution,Family song paper piece.
283,180,2023-06-04,Award,Mr professional hospital behavior consumer.
66,197,2022-07-15,Community Contribution,Interest seven day woman after second.
842,117,2023-02-18,Community Contribution,Response father debate investment firm.
638,113,2024-05-23,Award,Through occur agent all edge memory.
851,162,2023-01-30,Award,Must read score take car similar like.
66,187,2022-12-26,Award,Rather short season matter five range business bill.
948,134,2022-11-21,Certification,Career road century long film serve.
892,122,2024-01-05,Community Contribution,Entire high throughout live ago.
932,188,2022-11-18,Community Contribution,Office lose prove take sit around unit long.
896,118,2023-10-06,Award,Describe kitchen field much suggest professional new.
213,140,2022-12-17,Award,Still case somebody TV price.
586,168,2023-11-18,Award,Bring try word second TV hair.
171,161,2023-04-30,Award,Forward example yet much democratic similar.
877,164,2022-12-24,Certification,Specific onto deep less.
263,153,2024-04-19,Community Contribution,Reveal check article above candidate civil.
731,189,2023-01-03,Award,Into simply particularly.
941,122,2023-02-08,Certification,Statement trade none company both help fear head.
265,190,2023-08-20,Community Contribution,My first also necessary reach.
734,167,2022-09-21,Community Contribution,Whole sound sing whatever military woman.
12,112,2024-01-23,Community Contribution,Around support station business run.
323,166,2023-03-28,Award,Enter thus member however generation play avoid.
874,185,2024-01-15,Community Contribution,Summer painting mother hour all you think.
581,182,2022-07-17,Certification,Right drop party military memory.
57,141,2023-09-26,Award,Natural tough base fear matter test.
487,110,2024-06-17,Community Contribution,Sense either suddenly popular.
689,137,2023-07-17,Award,Parent onto myself ahead nothing.
644,182,2024-03-08,Community Contribution,Well fall friend health realize sound large.
225,118,2023-12-01,Community Contribution,Friend entire case someone write sing even.
838,115,2022-11-02,Award,Else become notice all.
507,134,2023-07-01,Award,Fact environmental by mind billion meet seat college.
801,179,2023-05-18,Certification,Help decision upon feel southern late both once.
365,151,2023-09-09,Certification,Seven social power may TV west.
721,109,2023-01-17,Certification,Approach war agreement whether prove play season.
123,102,2023-01-11,Award,Suffer account happen indicate affect media.
226,126,2024-04-23,Community Contribution,Fast term window.
703,124,2023-05-22,Community Contribution,Challenge prepare age before black decision college capital.
734,148,2022-12-09,Certification,Have short force management summer store just.
724,130,2024-02-27,Certification,Week west author.
506,131,2023-10-29,Community Contribution,Play ask audience everybody rather.
947,145,2022-12-01,Community Contribution,Understand program pull positive sell.
407,165,2024-01-10,Certification,May the success deep back.
743,192,2023-03-20,Award,Dream avoid around manager half none.
